[
 {
  "id": "A2023-45:103:2024-07-01",
  "act_id": "A2023-45",
  "slug": "103",
  "language": "en",
  "as_of": "2024-07-01",
  "expected_text": "(1) Whoever commits murder shall be punished with death or imprisonment for life, and shall also be liable to fine. (2) When a group of five or more persons acting in concert commits murder on the ground of race, caste or community, sex, place of birth, language, personal belief or any other similar ground each member of such group shall be punished with death or with imprisonment for life, and shall also be liable to fine.",
  "source_url": "https://egazette.gov.in/",
  "verified_by": "format-example",
  "verified_on": "2026-10-27",
  "notes": "Format example only (tests/fixtures): not a hand-verified golden pair. Text as in the v0.1.1 sections table for BNS s. 103."
 }
]
